{
  "character_id": "CH_001",
  "name": "苏念",
  "aliases": ["念念", "苏小姐"],
  "role_type": "主角",
  "gender": "女",
  "age": "25岁",
  "height": "168cm",
  "body_type": "纤细高挑",
  "face_shape": "鹅蛋脸",
  "facial_bone_structure": "柔和，下颌线清晰",
  "skin_tone": "白皙偏冷调",
  "eyes": "杏眼，深棕色，眼尾微微上挑",
  "eyebrows": "自然弧形，颜色比发色略深",
  "nose": "鼻梁高挺，鼻头小巧",
  "mouth": "唇形饱满，自然粉色",
  "hair_color": "黑色",
  "hair_style": "及腰长发，发尾微卷",
  "default_outfit": "白色真丝衬衫搭配黑色高腰西装裤",
  "outfit_details": "衬衫领口微开，袖口卷至手腕，腰间系一条细皮带",
  "personality": "外表温柔内心坚韧，重生后冷静果断",
  "relationship_to_others": ["顾辰-前未婚夫", "苏婉-继妹/对手"],
  "emotion_pack": ["冷漠", "隐忍", "坚定", "释然"],
  "forbidden_changes": ["脸型", "眼睛形状", "发型", "身高"],
  "reference_image_plan": ["正面半身", "三分之二侧脸", "全身站姿", "表情九宫格"],
  "reference_assets": []
}
